<?xml version="1.0"?>
<!--
The MIT License

Copyright 2017 Kohwalter.

Permission is hereby granted, free of charge, to any person obtaining a copy
of this software and associated documentation files (the "Software"), to deal
in the Software without restriction, including without limitation the rights
to use, copy, modify, merge, publish, distribute, sublicense, and/or sell
copies of the Software, and to permit persons to whom the Software is
furnished to do so, subject to the following conditions:

The above copyright notice and this permission notice shall be included in
all copies or substantial portions of the Software.

THE SOFTWARE IS PROVIDED "AS IS", WITHOUT WARRANTY OF ANY KIND, EXPRESS OR
IMPLIED, INCLUDING BUT NOT LIMITED TO THE WARRANTIES OF MERCHANTABILITY,
FITNESS FOR A PARTICULAR PURPOSE AND NONINFRINGEMENT. IN NO EVENT SHALL THE
AUTHORS OR COPYRIGHT HOLDERS BE LIABLE FOR ANY CLAIM, DAMAGES OR OTHER
LIABILITY, WHETHER IN AN ACTION OF CONTRACT, TORT OR OTHERWISE, ARISING FROM,
OUT OF OR IN CONNECTION WITH THE SOFTWARE OR THE USE OR OTHER DEALINGS IN
THE SOFTWARE.
-->

<xs:schema version="1.0"
           xmlns:xs="http://www.w3.org/2001/XMLSchema"
           elementFormDefault="qualified">
    
    <xs:element name="provenancedata" type="provdata"/>
    
    <!-- Configuration Type -->
    <xs:complexType name="provdata">
        <xs:sequence>
            <!-- List of all vertices and their configuration values -->
            <xs:element name="vertices" type="vertices" minOccurs="1" maxOccurs="1"/>
            <!-- List of all edges and their configuration values -->
            <xs:element name="edges" type="edges" minOccurs="1" maxOccurs="1"/>
        </xs:sequence>
    </xs:complexType>
	
	<!-- Vertex List -->
    <xs:complexType name="vertices">
        <xs:sequence>
            <xs:element name="vertex" type="vertex" minOccurs="0" maxOccurs="unbounded"/>
        </xs:sequence>
    </xs:complexType>
	
	<!-- Edges List -->
	<xs:complexType name="edges">
        <xs:sequence>
            <xs:element name="edge" type="edge" minOccurs="0" maxOccurs="unbounded"/>
        </xs:sequence>
    </xs:complexType>
	
    <!-- Edge Type -->
    <xs:complexType name="edge">
        <xs:sequence>
            <!-- Edge unique ID -->
            <xs:element name="ID" type="xs:string"/>
            <!-- Edge type -->
            <xs:element name="type" type="xs:string"/>
            <!-- Edge label -->
            <xs:element name="label" type="xs:string"/>
            <!-- Edge value -->
            <xs:element name="value" type="xs:string"/>
            <!-- Source vertex's unique ID -->
            <xs:element name="sourceID" type="xs:string"/>
            <!-- Target vertex's unique ID -->
            <xs:element name="targetID" type="xs:string"/>
        </xs:sequence>
    </xs:complexType>
    
    <!-- Vertex Node -->
    <xs:complexType name="vertex">
        <xs:sequence>
            <!-- Vertex unique ID -->
            <xs:element name="ID" type="xs:string"/>
            <!-- Vertex type (Activity, Entity, Agent) -->
            <xs:element name="type" type="xs:string"/>
            <!-- Vertex label -->
            <xs:element name="label" type="xs:string"/>
            <!-- Vertex Date of Creation/Appearance -->
            <xs:element name="date" type="xs:string"/>
            <!-- Vertex Attributes -->
            <xs:element name="attributes" type="attributes" minOccurs="1" maxOccurs="1"/>
        </xs:sequence>
    </xs:complexType>
    
	<!-- Attribute List -->
    <xs:complexType name="attributes">
        <xs:sequence>
            <xs:element name="attribute" type="vertexattribute" minOccurs="0" maxOccurs="unbounded"/>
        </xs:sequence>
    </xs:complexType>
	
    <!-- Special Vertex Stroke -->
    <xs:complexType name="vertexattribute">
        <xs:sequence>
            <xs:element name="name" type="xs:string"/>
            <xs:element name="value" type="xs:string"/>
        </xs:sequence>
    </xs:complexType>  

</xs:schema>
