<?xml version="1.0" encoding="UTF-8"?>
<!--
To change this template, choose Tools | Templates
and open the template in the editor.
-->


<provenancedata
    xmlns:xsi='http://www.w3.org/2001/XMLSchema-instance'
    xsi:noNamespaceSchemaLocation='input.xsd'>
	<vertex>
        <ID>ent0</ID>
        <type>Entity</type>
        <label>Village</label>
        <date>0</date>
        <attributes>
			<attribute>  
				<name>ObjectPosition_X</name>
				<value>0</value>
			</attribute>
			<attribute>
				<name>ObjectPosition_Y</name>
				<value>0</value>
			</attribute>
		</attributes>
    </vertex>
	<vertex>
        <ID>ent1</ID>
        <type>Entity</type>
        <label>Forest</label>
        <date>1</date>
        <attributes>
			<attribute>  
				<name>ObjectPosition_X</name>
				<value>2</value>
			</attribute>
			<attribute>
				<name>ObjectPosition_Y</name>
				<value>3</value>
			</attribute>
		</attributes>
    </vertex>
	<vertex>
        <ID>ent2</ID>
        <type>Entity</type>
        <label>Village</label>
        <date>2</date>
        <attributes>
			<attribute>  
				<name>ObjectPosition_X</name>
				<value>0</value>
			</attribute>
			<attribute>
				<name>ObjectPosition_Y</name>
				<value>0</value>
			</attribute>
		</attributes>
    </vertex>
	<vertex>
        <ID>ent3</ID>
        <type>Entity</type>
        <label>Dungeon</label>
        <date>3</date>
        <attributes>
			<attribute>  
				<name>ObjectPosition_X</name>
				<value>3</value>
			</attribute>
			<attribute>
				<name>ObjectPosition_Y</name>
				<value>0</value>
			</attribute>
		</attributes>
    </vertex>
	<vertex>
        <ID>ent4</ID>
        <type>Entity</type>
        <label>Plains</label>
        <date>4</date>
        <attributes>
			<attribute>  
				<name>ObjectPosition_X</name>
				<value>5</value>
			</attribute>
			<attribute>
				<name>ObjectPosition_Y</name>
				<value>1</value>
			</attribute>
		</attributes>
    </vertex>
	<vertex>
        <ID>ent5</ID>
        <type>Entity</type>
        <label>Town</label>
        <date>5</date>
        <attributes>
			<attribute>  
				<name>ObjectPosition_X</name>
				<value>6</value>
			</attribute>
			<attribute>
				<name>ObjectPosition_Y</name>
				<value>-1</value>
			</attribute>
		</attributes>
    </vertex>
    <edge>
        <ID>e0</ID>
        <label>Neutral</label>
        <type>wlabelerivedFrom</type>
        <value></value>
        <sourceID>ent1</sourceID>
        <targetID>ent0</targetID>
    </edge>
	<edge>
        <ID>e1</ID>
        <label>Neutral</label>
        <type>wlabelerivedFrom</type>
        <value></value>
        <sourceID>ent2</sourceID>
        <targetID>ent1</targetID>
    </edge>
	<edge>
        <ID>e2</ID>
        <label>Neutral</label>
        <type>wlabelerivedFrom</type>
        <value></value>
        <sourceID>ent3</sourceID>
        <targetID>ent2</targetID>
    </edge>
	<edge>
        <ID>e3</ID>
        <label>Neutral</label>
        <type>wlabelerivedFrom</type>
        <value></value>
        <sourceID>ent4</sourceID>
        <targetID>ent3</targetID>
    </edge>
	<edge>
        <ID>e4</ID>
        <label>Neutral</label>
        <type>wlabelerivedFrom</type>
        <value></value>
        <sourceID>ent5</sourceID>
        <targetID>ent4</targetID>
    </edge>
</provenancedata>
