<?xml version="1.0" encoding="UTF-8"?>
<!--
To change this template, choose Tools | Templates
and open the template in the editor.
-->


<provenancedata
    xmlns:xsi='http://www.w3.org/2001/XMLSchema-instance'
    xsi:noNamespaceSchemaLocation='input.xsd'>
	<vertex>
        <ID>ent0</ID>
        <type>Entity</type>
        <label>Project</label>
        <date>0</date>
        <attribute>
            <name>Deadline</name>
            <value>32</value>
        </attribute>
	<attribute>
            <name>ProgrammingLanguage</name>
            <value>java</value>
        </attribute>
	<attribute>
            <name>Payment</name>
            <value>15000</value>
        </attribute>
        <attribute>
            <name>Credits</name>
            <value>40000</value>
        </attribute>
    </vertex>
	<vertex>
        <ID>ent1</ID>
        <type>Entity</type>
        <label>Project</label>
        <date>1</date>
        <attribute>
            <name>Deadline</name>
            <value>32</value>
        </attribute>
	<attribute>
            <name>ProgrammingLanguage</name>
            <value>java</value>
        </attribute>
	<attribute>
            <name>Payment</name>
            <value>15000</value>
        </attribute>
        <attribute>
            <name>Credits</name>
            <value>39791</value>
        </attribute>
    </vertex>
	<vertex>
        <ID>ent2</ID>
        <type>Entity</type>
        <label>Project</label>
        <date>2</date>
        <attribute>
            <name>Deadline</name>
            <value>32</value>
        </attribute>
	<attribute>
            <name>ProgrammingLanguage</name>
            <value>java</value>
        </attribute>
	<attribute>
            <name>Payment</name>
            <value>15000</value>
        </attribute>
        <attribute>
            <name>Credits</name>
            <value>30011</value>
        </attribute>
    </vertex>
	<vertex>
        <ID>ent3</ID>
        <type>Entity</type>
        <label>Project</label>
        <date>3</date>
        <attribute>
            <name>Deadline</name>
            <value>32</value>
        </attribute>
    </vertex>
	<vertex>
        <ID>ent4</ID>
        <type>Entity</type>
        <label>Project</label>
        <date>4</date>
        <attribute>
            <name>Deadline</name>
            <value>32</value>
        </attribute>
    </vertex>
    <edge>
        <ID>e0</ID>
        <label>Neutral</label>
        <type>wlabelerivedFrom</type>
        <value></value>
        <sourceID>ent1</sourceID>
        <targetID>ent0</targetID>
    </edge>
	<edge>
        <ID>e1</ID>
        <label>Neutral</label>
        <type>wlabelerivedFrom</type>
        <value></value>
        <sourceID>ent2</sourceID>
        <targetID>ent1</targetID>
    </edge>
	<edge>
        <ID>e2</ID>
        <label>Neutral</label>
        <type>wlabelerivedFrom</type>
        <value></value>
        <sourceID>ent3</sourceID>
        <targetID>ent2</targetID>
    </edge>
	<edge>
        <ID>e3</ID>
        <label>Neutral</label>
        <type>wlabelerivedFrom</type>
        <value></value>
        <sourceID>ent4</sourceID>
        <targetID>ent3</targetID>
    </edge>
</provenancedata>
